{
  "schemaVersion": "1.0",
  "canonicalizationVersion": "jcs-rfc8785-v1",
  "documentStatus": "DRAFT",
  "revision": 1,
  "publicationHistory": {
    "status": "UNCONFIRMED",
    "environments": []
  },
  "eventVersionDecision": {
    "decision": "UNDECIDED",
    "targetEventType": null,
    "targetSchemaVersion": null,
    "migrationPlan": null
  },
  "artifacts": {
    "tdDocument": null,
    "productionSchema": null,
    "testPlan": null,
    "consumerInventory": null
  },
  "requiredFields": [],
  "testCoverage": [],
  "approval": null
}
